title,link,description,pubDate,guid
http://twitter.com/sggt_uk/status/1034060937253322752,http://twitter.com/sggt_uk/status/1034060937253322752,,"Mon, 27 Aug 2018 12:51:54 GMT",
http://twitter.com/bitmari_/status/1034060851744002049,http://twitter.com/bitmari_/status/1034060851744002049,,"Mon, 27 Aug 2018 12:51:33 GMT",
[Infographic] Top Tech for School Buses,https://elearningfeeds.com/infographic-top-tech-for-school-buses/,"...focusing on first?With so much <b>technology</b> now available such as telematics, cameras inside and ... Kajeet wanted to know the latest <b>technology</b> bus...","Mon, 27 Aug 2018 12:51:01 GMT",
http://twitter.com/SA_Heroes/status/1034060289841479682,http://twitter.com/SA_Heroes/status/1034060289841479682,,"Mon, 27 Aug 2018 12:49:19 GMT",
http://twitter.com/ManuelPadillaJr/status/1034059290875703299,http://twitter.com/ManuelPadillaJr/status/1034059290875703299,,"Mon, 27 Aug 2018 12:45:21 GMT",
BirdsiVideo Hosts Drone Seminar with University of North Carolina,https://www.suasnews.com/2018/08/birdsivideo-hosts-drone-seminar-with-university-of-north-carolina/,"BirdsiVideo ( www.birdsivideo.com ) hosted an educational seminar on drone <b>technology</b> with the Raleigh Read-and-Go program and Center for Design Innovation of Winston-Salem on July 11, 2018. Roger...","Mon, 27 Aug 2018 12:42:37 GMT",
Family tackles widow over husband’s death • She killed him with hot...,http://allforums.com.ng/showthread.php?tid=206844,"...of Mr Adeyinka Olusa, a former auditor at the School of Health <b>Technology</b>, Akure, Ondo State, have been in the morgue of the University College Hospital, Ibadan, Oyo State, for about eight months...","Mon, 27 Aug 2018 12:40:11 GMT",
Institute of Wood Research,http://www.forum.ustron.pl/viewtopic.php?f=2&t=8668,...China Forestry Science Research Institute--Linlin Institute Fulin <b>Technology</b> R&amp;D Center was established...,"Mon, 27 Aug 2018 12:40:00 GMT",
Blood cancer patients benefit from breakthrough genetic testing...,https://medicalxpress.com/news/2018-08-blood-cancer-patients-benefit-breakthrough.html,Cutting-edge DNA sequencing <b>technology</b> has been used by QUT researchers at the new Australian ... state.&quot;Queensland University of <b>Technology</b>,"Mon, 27 Aug 2018 12:39:16 GMT",
http://twitter.com/ISCEBS/status/1034057175134547968,http://twitter.com/ISCEBS/status/1034057175134547968,,"Mon, 27 Aug 2018 12:36:57 GMT",
The idea of United States of South India is a dangerous one,https://rightlog.in/2018/08/south-india-01/,"People from some region could be good in <b>technology</b>, some other good for defense, some could be... The Jewish people who virtually rule media and <b>technology</b> industry of United States are second or...","Mon, 27 Aug 2018 12:36:29 GMT",
No solid agreement reached over demand for amnesty for #feesmustfall...,https://www.dailymaverick.co.za/article/2018-08-27-no-solid-agreement-reached-over-demand-for-amnesty-for-feesmustfall-activists/,"...activistsJustice Minister Michael Masutha and a Durban University of <b>Technology</b> graduate, Bonginkosi Khanyile were both present at a press briefing on Monday morning, though Khanyile refused to...","Mon, 27 Aug 2018 12:33:45 GMT",
5 Steps to Creating Personalized Content Experiences for ABM,https://blog.marketo.com/2018/08/5-steps-to-creating-personalized-content-experiences-for-abm.html,"...they have, their location, sector, and industry Technographics: <b>Technology</b> the account uses, and their level of technological maturity Sociographics: The account’s business challenges and their...","Mon, 27 Aug 2018 12:30:35 GMT",
http://twitter.com/wsp/status/1034055430174138368,http://twitter.com/wsp/status/1034055430174138368,,"Mon, 27 Aug 2018 12:30:01 GMT",
الأساليب الحديثة في إدارة الموارد البشرية في العصر الحديث,http://www.saloonati.com/vb/showthread.php?t=84857,...دورة: إدارة تكنولوجيا الأداء البشرى وجودة العمل Human Performance <b>Technology</b> and the quality of work management دورة: تنظيم وإدارة القوى العاملة وتحليل الأعمال وجودة التدريب Organization and...,"Mon, 27 Aug 2018 12:30:00 GMT",
Password Management Remains an Issue — What's Next?,https://securityintelligence.com/password-management-remains-an-issue-whats-next/,"My specialties are cybersecurity and <b>technology</b>, which I&#39;ve covered on behalf of a variety of ... what industry doesn&#39;t rely on <b>technology</b> or require security systems?). Throughout the years I&#39;ve...","Mon, 27 Aug 2018 12:28:23 GMT",
Zuckerberg (not Mark) signs on to advise a major cryptocurrency...,https://thenextweb.com/hardfork/2018/08/27/zuckerberg-adviser-cryptocurrency-huobi/,"...provide expert opinions [on] Huobi’s public chain, from the basic <b>technology</b> of the blockchain to its industrial applications, commercial modeling, etc. It will also help during the Huobi Public...","Mon, 27 Aug 2018 12:18:35 GMT",
Scotland’s Independence Via 3 Phase Blockchain Roadmap,https://yesdayscotland.wordpress.com/2018/08/27/scotlands-independence-via-3-phase-blockchain-roadmap/,"...new global blockchain <b>technology</b>, familiarising Scotland with the...","Mon, 27 Aug 2018 12:16:19 GMT",
Ally Invest Introduces Diverse Set of Commission-Free Exchange-Traded...,https://media.ally.com/2018-08-27-Ally-Invest-Introduces-Diverse-Set-of-Commission-Free-Exchange-Traded-Funds,"...justice, environmental sustainability and alternative energy/clean <b>technology</b> efforts.&quot;Ally and WisdomTree share a similar philosophy of using innovation to deliver the very best value for...","Mon, 27 Aug 2018 12:15:12 GMT",
Bon plan : l’enceinte connectée Amazon Echo à -20%,https://www.begeek.fr/bon-plan-enceinte-connectee-amazon-echo-20-pourcent-277093,"...l’enceinte, grâce à la technologie en champ lointain (far field <b>technology</b> ) et à la réduction de bruit intégrée — ce qui permet également à l’enceinte de vous entendre même lorsqu’il y a de la...","Mon, 27 Aug 2018 12:15:08 GMT",
This Is The Tech Bubble We Have Been Ready For,http://www.thaipromoteweb.bid/index.php?topic=13900.0,"...expensive after the ICO. Advanced <b>technology</b> constructed for each ICO: new tokens, web sites, fee ... about $1.7 billion. Blockchain <b>technology</b> and cryptocurrencies have certainly paved away for the...","Mon, 27 Aug 2018 12:14:00 GMT",
ندوة تدريبية تخزين ونقل المنتجات النفطية,http://www.hrm-group.net/vb/showthread.php?150281-%D9%86%D8%AF%D9%88%D8%A9-%D8%AA%D8%AF%D8%B1%D9%8A%D8%A8%D9%8A%D8%A9-%D8%AA%D8%AE%D8%B2%D9%8A%D9%86-%D9%88%D9%86%D9%82%D9%84-%D8%A7%D9%84%D9%85%D9%86%D8%AA%D8%AC%D8%A7%D8%AA-%D8%A7%D9%84%D9%86%D9%81%D8%B7%D9%8A%D8%A9-%D8%AF%D9%88%D8%B1%D8%A7%D8%AA-%D8%A7%D9%84%D8%A8%D8%AA%D8%B1%D9%88%D9%84-%D8%A7%D9%84%D9%86%D9%81%D8%B7-%D9%88%D8%A7%D9%84%D8%BA%D8%A7%D8%B2,...Pipe <b>technology</b> in the petroleum industry التكنولوجيا في الصناعات البترولية <b>Technology</b> in the ... المياه - متقدم Water Treatment <b>Technology</b> - Advanced اسيات تكرير النفط oil refining fundamentals...,"Mon, 27 Aug 2018 12:14:00 GMT",
Lahvlann: Up the reek without a coddle | 26/07 two 18 so to speak,https://www.boards.ie/b/thread/2057895554/286#107909873,Monte said: This old rubbish - Europe needs them. Next week it will be news about how <b>technology</b> will leave hundreds of thousands redundant across Europe. Both lines of thought can&#39;t be right. We...,"Mon, 27 Aug 2018 12:11:00 GMT",
"MarTech Today: Dstillery’s new Dscover Maps, a blended ABM approach &...",https://martechtoday.com/martech-today-dstillerys-new-dscover-maps-a-blended-abm-approach-enterprise-customer-data-platforms-223302,"...<b>technology</b>, and management converge.Here’s our recap of what happened in marketing <b>technology</b> ... Barry Levine covers marketing <b>technology</b> for Third Door Media. Previously, he covered this space as...","Mon, 27 Aug 2018 12:09:48 GMT",
Ripple Confirms American Express is Testing xRapid Tech,https://theindependentrepublic.com/2018/08/27/interest-american-express-proof-ripple-future/,"...Express is poised to use the <b>technology</b>. Revealed by current CTO Stefan Thomas during a recent ... facilitate on-demand liquidity, the <b>technology</b> has shown that it’s able to facilitate real-time...","Mon, 27 Aug 2018 12:09:03 GMT",
Russian Trolls 'Spread Vaccine Misinformation' Online,https://www.bankinfosecurity.com/russian-trolls-spread-vaccine-misinformation-online-a-11421,"None of the contestants were able to completely automate their ability to identify which accounts were bots, MIT <b>Technology</b> Review reported.But SentiMetrix was able to use an algorithm that it...","Mon, 27 Aug 2018 12:02:44 GMT",
http://twitter.com/AgomCheche/status/1034044176701120512,http://twitter.com/AgomCheche/status/1034044176701120512,,"Mon, 27 Aug 2018 11:45:17 GMT",
http://twitter.com/bamitav/status/1034041861596434432,http://twitter.com/bamitav/status/1034041861596434432,,"Mon, 27 Aug 2018 11:36:06 GMT",
Hospitals spend big bucks on advertising. Here’s a look at the cost of...,https://www.fiercehealthcare.com/hospitals-health-systems/hospitals-spending-big-bucks-advertising-a-look-cost-8-ad-campaigns,"The healthcare sector remains in flux as policy, regulation, <b>technology</b> and trends shape the market. FierceHealthcare subscribers rely on our suite of newsletters as their must-read source for the...","Mon, 27 Aug 2018 11:35:00 GMT",
"...Оберон, препараты Growth Technology, Valagro-Плантафол, Осмокот...",http://www.flowersweb.info/forum/forum10/topic181940/messages/?PAGEN_1=9#message4830369,#177 27.08.2018 13:34:56 Куплю в среду 29.08 Плантафол 10:54:10 Удобрение с высоким содержанием фосфора для стимуляции цветений. Применяют для геснериевых в концентрации 1г на литр в нужный период...,"Mon, 27 Aug 2018 11:34:56 GMT",
Improved efficiency and stability of CQD solar cells using an organic...,https://phys.org/news/2018-08-efficiency-stability-cqd-solar-cells.html,"...conditions.Professor Lee said, &quot;This <b>technology</b> can be also applied to QD LEDs and Perovskite devices. I hope this <b>technology</b> can hasten the commercialization of CQD-based solar cells .&quot;Se-Woong...","Mon, 27 Aug 2018 11:31:07 GMT",
most flooring companies still need a process,http://www.forum.ustron.pl/viewtopic.php?f=2&t=8667,"build your own garden fence without With the continuous development of Internet <b>technology</b>, online shopping and online payment are gradually replacing the traditional retail methods of products at...","Mon, 27 Aug 2018 11:25:00 GMT",
http://twitter.com/RachelLagacectv/status/1034038974485024768,http://twitter.com/RachelLagacectv/status/1034038974485024768,,"Mon, 27 Aug 2018 11:24:37 GMT",
China Is Developing 'Electromagnetic Rocket' With Greater Fire Range,https://southfront.org/china-is-developing-electromagnetic-rocket-with-greater-fire-range/,"...scientist, who spoke to Science and <b>Technology</b> Daily. He said that “substantial progress” has been ... catapult launchers. The same <b>technology</b> is used to develop railguns. An electromagnetic railgun is...","Mon, 27 Aug 2018 11:17:21 GMT",
أساليب تخطيط الحملات الإعلانية والترويجية,http://aalomar.com/vb/showthread.php?t=17455,...relations and media using information <b>technology</b> دورة: إدارة الفعاليات والمؤتمرات Events and ... العلاقات العامة Use of information <b>technology</b> in support of public relations activities دورة...,"Mon, 27 Aug 2018 11:16:00 GMT",
أساليب الشراء المتقدمة وتقنيات حفظ الكلفة,http://aalomar.com/vb/showthread.php?t=17452,...inventory strategies to improve <b>technology</b> دورة: الإتجاهات الفنية المتقدمة فى إدارة المخازن والتحكم ... وإدارة منازعات عقود الشراء Process <b>technology</b> procurement and management of disputes procurement...,"Mon, 27 Aug 2018 11:08:00 GMT",
How to Create an Effective Content Marketing Strategy,https://marketinginsidergroup.com/content-marketing/how-to-create-an-effective-content-marketing-strategy/,"...production More sophisticated use of <b>technology</b> Better informed metrics And, more confidence – and... This means looking at your marketing <b>technology</b> to make sure you are capable of offering better...","Mon, 27 Aug 2018 11:05:18 GMT",
Why television (TV) news is dying a slow death in world of millennial,https://rightlog.in/2018/08/television-news-dying-millennial-01/,It will be interesting to see whether TV will be able to survive or will have to bend the knees in front of a new <b>technology</b> just like previous mediums of mass...,"Mon, 27 Aug 2018 11:02:00 GMT",
Bitcoin Peddlers Impersonates Maltese Prime Minister on Instagram,https://news.bitzamp.com/bitcoin-peddlers-impersonates-maltese-prime-minister-on-instagram/,"...proponent of crypto and blockchain <b>technology</b>, The prime ministerThe Malta Independent recently ... proponent of crypto and blockchain <b>technology</b> , The prime minister is seemingly a good choice for...","Mon, 27 Aug 2018 11:01:17 GMT",
Flutter vs. React Native — Everything You Need to Know,https://medium.com/flutterpub/flutter-vs-react-native-everything-you-need-to-know-1cbde3f95859,"...such as articles, videos, codes, podcasts etc. about this great <b>technology</b> to teach you how to build beautiful apps with it. You can find us on Facebook , Twitter , and Medium or learn more about us...","Mon, 27 Aug 2018 10:57:41 GMT",
تنمية مهشارات الإدراك والدخول الآمن إلى الأماكن الضيقة,http://aalomar.com/vb/showthread.php?t=17448,...البيئى Environmental systems and <b>technology</b> to control environmental pollution management دورة ... السلامة وتحليل المخاطر Modern <b>technology</b> in safety and risk analysis دورة: تقييم أداء مشرفي السلامة...,"Mon, 27 Aug 2018 10:50:00 GMT",
Russian Trolls 'Spread Vaccine Misinformation' Online,https://www.databreachtoday.com/russian-trolls-spread-vaccine-misinformation-online-a-11421,"...accounts were bots, MIT <b>Technology</b> Review reported.But SentiMetrix...","Mon, 27 Aug 2018 10:35:07 GMT",
Determining the Date of the Exodus,https://www.breakingisraelnews.com/112965/radiocarbon-study-date-biblical-exodus/,"...calibration method is ready for an improvement. Because now the <b>technology</b> is there to measure the radiocarbon in every single tree ring, and we’re just pulling out one treasure from the box — in...","Mon, 27 Aug 2018 10:35:03 GMT",
Many think crypto is dead. It is not.,https://bitcointalk.org/index.php?topic=4925257.140#msg44767415,"I&#39;m very much convinced within me that crypto is not dead. This <b>technology</b> has gone viral. So many countries of the world are becoming very much interested in it, transactions are done on a daily...","Mon, 27 Aug 2018 10:18:09 GMT",
http://twitter.com/RoseTheReyes/status/1034018978480435200,http://twitter.com/RoseTheReyes/status/1034018978480435200,,"Mon, 27 Aug 2018 10:05:10 GMT",
Jen Owen of Enablingthefuture.org Needs Your Stories and Support,https://3dprint.com/223478/jen-owen-of-enablingthefuture-org-needs-your-stories-and-support/,These hands work and are cost effective showcasing that 3D printing is not only an inspirational <b>technology</b> but also an affordable and practical one. Please support hardworking Jen and E-Nable if...,"Mon, 27 Aug 2018 09:53:49 GMT",
http://twitter.com/lifi_congress/status/1034015446251577344,http://twitter.com/lifi_congress/status/1034015446251577344,"Mon, 27 Aug 2018 09:51:08 GMT",,
Tesla communications Chief Sarah O'Brien is leaving,http://adage.com/article/cmo-strategy/tesla-communications-chief-sarah-o-brien-leaving/314723/,"It is also an exhausting one, as the company receives an enormous amount of attention from the automotive, financial, <b>technology</b> and mainstream press. Musk himself is the public face and voice of...","Mon, 27 Aug 2018 09:43:29 GMT",
http://twitter.com/BBCScienceNews/status/1034009554168815617,http://twitter.com/BBCScienceNews/status/1034009554168815617,,"Mon, 27 Aug 2018 09:27:43 GMT",
20 Free Courses on Design and Development,https://www.practicalecommerce.com/20-free-courses-design-development,"...from leading universities and <b>technology</b> experts. Here is a list of free courses to improve your... Instructional Design: Digital Media, New Tools and <b>Technology</b>. From the University of Maryland...","Mon, 27 Aug 2018 09:24:17 GMT",
http://twitter.com/catherinebuk/status/1034008110078328832,http://twitter.com/catherinebuk/status/1034008110078328832,,"Mon, 27 Aug 2018 09:21:59 GMT",
North Korea to Host its First-Ever International Crypto Conference...,https://thebitcointalk.net/index.php?topic=4964199.0,"...international conference focusing on cryptocurrencies and blockchain <b>technology</b> in October. According to Radio Free Asia, the event will be held in the hermit kingdom’s capital of Pyongyang and will...","Mon, 27 Aug 2018 09:14:30 GMT",
North Korea to Host its First-Ever International Crypto Conference...,https://bitcointalk.org/index.php?topic=4964199.0,"...international conference focusing on cryptocurrencies and blockchain <b>technology</b> in October. According to Radio Free Asia, the event will be held in the hermit kingdom’s capital of Pyongyang and will...","Mon, 27 Aug 2018 09:14:30 GMT",
North Korea to Host its First-Ever International Crypto Conference...,http://fonstavka.com/index.php?topic=4964199.0,"...international conference focusing on cryptocurrencies and blockchain <b>technology</b> in October. According to Radio Free Asia, the event will be held in the hermit kingdom’s capital of Pyongyang and will...","Mon, 27 Aug 2018 09:14:30 GMT",
Metro and Seattle promised electric trolleybuses on Madison RapidRide...,https://www.seattletimes.com/seattle-news/transportation/metro-and-seattle-promised-electric-trolleybuses-on-a-new-madison-rapidride-turns-out-that-wont-work/,"Local News Local Politics <b>Technology</b> Traffic Lab An uphill battle to get electric trolleybuses on Madison RapidRide routeOriginally published August 27, 2018 at...","Mon, 27 Aug 2018 09:00:00 GMT",
Ten Offensive Player of the Year auto space tv,http://autospace.tv/phpBB3/viewtopic.php?f=4&t=6190,"&quot;Our intent is to go to each team with tape and all the analysis work done (by the football operations, <b>technology</b> and medical staffs) and be able to present it to them,&quot; Goodell said, adding it...","Mon, 27 Aug 2018 08:45:00 GMT",
"Jerry Chan: You shouldn’t just be ideological, blockchain should be...",https://coingeek.com/jerry-chan-shouldnt-just-ideological-blockchain-profitable-video/,"...the coming years.Blockchain <b>technology</b> attracts its users and advocates for various reasons. A ... point where we can innovate, use <b>technology</b> to change the old systems and provide better systems...","Mon, 27 Aug 2018 08:38:17 GMT",
Spotify stock rises after Monness starts coverage with buy rating,https://www.marketwatch.com/story/spotify-stock-rises-after-monness-starts-coverage-with-buy-rating-2018-08-27,"Shares of Spotify <b>Technology</b> SA SPOT, are up 1.7% in Monday morning trading after Monness, Crespi, Hardt &amp; Co. analyst Brian White began coverage with a...","Mon, 27 Aug 2018 08:03:00 GMT",
Sandlådan • Visa tråd - Nike Air Max 270 Flyknit Trainer | White /...,http://lemonbird.se/phpBB3/viewtopic.php?f=28&t=4394,"En 1993, la chaussure était un grand pas en avant pour Nike Air <b>Technology</b>. Pour Air Max Day 2018 Nike Sportswear sera lancé à la Nike Air Max 270. Alors que nous aurons la chance d&#39;acheter...","Mon, 27 Aug 2018 07:57:00 GMT",
AMD Is All In On 7nm CPUs For Strategic Advantage On Intel’s 10nm...,https://hothardware.com/news/amd-all-in-7nm-cpus-strategic-advantage-intels-10nm-stumble,"No matter how you shake (or measure) it, though, 2019 is shaping up to be a very interesting year in CPU design and <b>technology</b> in...","Mon, 27 Aug 2018 07:52:00 GMT",
In this fast-paced commercial,http://www.reisezielforum.de/in-this-fast-paced-commercial-t14350.html,"...Davenport Limited Jersey , adorn and enhance their mobile devices. <b>Technology</b>, design and fashion aficionados have successfully created an extensive collection of mobile and tablet cases defined for...","Mon, 27 Aug 2018 07:44:00 GMT",
Microsoft reportedly shelved an Xbox VR headset,https://www.engadget.com/2018/08/27/report-microsoft-stopped-working-on-xbox-vr-headset/,"It makes sense that, considering Xbox sales are lagging behind the PS4&#39;s, the company wouldn&#39;t want to go all in on a <b>technology</b> that hasn&#39;t been overwhelmingly popular. Instead, the company is...","Mon, 27 Aug 2018 07:42:00 GMT",
Recreate Cinnamon on KDE technologies.,https://forums.linuxmint.com/viewtopic.php?f=29&t=276413,Plus I believe it fixes the mouse/window &#39;lag&#39; Mint exhibits. -Uses QT toolkit - okay it&#39;s another <b>technology</b> to learn but it&#39;s more stable than GTK and not so driven by the needs of a single...,"Mon, 27 Aug 2018 07:40:00 GMT",
Karabas's Journal: Part 2,https://forum.gamequitters.com/index.php?/topic/6695-karabass-journal-part-2/&page=2#comment-47691,"...had a pretty chilling revelation just now. I realized that my <b>technology</b>, content, etc addiction is at the root of something I&#39;ve been very worried about for some time now. What I&#39;ve been worried...","Mon, 27 Aug 2018 07:38:26 GMT",
Bloomberg Google Pixel 3 to launch on October 9th at NYC event (Ben...,https://www.techmeme.com/180827/p12,"...leeway over how personal information is handled — WASHINGTON — <b>Technology</b> companies have taken plenty of hits on privacy this year. In May, Europe began enforcing a sweeping …More: 9to5Mac...","Mon, 27 Aug 2018 07:38:00 GMT",
The Complexity of the “Cyber Security” Role — When 52 Becomes One,https://medium.com/asecuritysite-when-bob-met-alice/the-complexity-of-the-cyber-security-role-when-52-becomes-one-c4da2a6838cd,Risk Management (RSK); Software Development (DEV); Systems Architecture (ARC); <b>Technology</b> R&amp;D (TRD); Systems Requirements Planning (SRP); Test and Evaluation (TST) Operate and Maintain (OM) . Data...,"Mon, 27 Aug 2018 07:34:18 GMT",
Russian Trolls 'Spread Vaccine Misinformation' Online,https://www.inforisktoday.com/russian-trolls-spread-vaccine-misinformation-online-a-11421,"...accounts were bots, MIT <b>Technology</b> Review reported.But SentiMetrix...","Mon, 27 Aug 2018 07:29:44 GMT",
Gamaprintpro,http://flame-guards.com/forum/viewtopic.php?f=14&t=159436,1 Win64 ANSYS.PRODUCTS.v16.1.WINX64LINUX64 Applied Flow <b>Technology</b> Arrow v5.0.1111 Applied Flow <b>Technology</b> Mercury v7.0 Applied Flow <b>Technology</b> Titan v4.0...,"Mon, 27 Aug 2018 07:12:00 GMT",
AMD announces dual-GPU Radeon Pro V340 with 32GB of HBM2,https://www.techspot.com/community/topics/amd-announces-dual-gpu-radeon-pro-v340-with-32gb-of-hbm2.248700/,...benefit from true GPU virtualization. AMD has enabled its own MxGPU <b>Technology</b> for GPU virtualization so that high performance cloud computing is possible without having to pay royalties or licensing...,"Mon, 27 Aug 2018 07:03:00 GMT",
"Cleveland's Leaders are ""Old and Not Smart"" and Other Weaknesses of...",https://www.clevescene.com/scene-and-heard/archives/2018/08/27/clevelands-leaders-are-old-and-not-smart-and-other-weaknesses-of-our-civic-culture,"...posed and vote on the answers anonymously and in real-time.The <b>technology</b>&#39;s strengths include providing tons of immediate data, and allowing people in multiple locations to participate. Its...","Mon, 27 Aug 2018 07:02:00 GMT",
http://twitter.com/Blockshipping/status/1033972435723472896,http://twitter.com/Blockshipping/status/1033972435723472896,,"Mon, 27 Aug 2018 07:00:13 GMT",
Bad Android apps: How can Google's new detection model help?,https://searchsecurity.techtarget.com/answer/Bad-Android-apps-How-can-Googles-new-detection-model-help,"...system, which is based on the Linux kernel, is largely open source <b>technology</b> that runs on proprietary devices.Google initially used basic checks to ensure that the apps populated by the Google...","Mon, 27 Aug 2018 07:00:00 GMT",
http://twitter.com/CNBC/status/1033968101652606976,http://twitter.com/CNBC/status/1033968101652606976,,"Mon, 27 Aug 2018 06:43:00 GMT",
Blockchain Company Skycoin Announces Release Date of Android Mobile...,https://nulltx.com/blockchain-company-skycoin-announces-release-date-of-android-mobile-wallet/,"...node action. Fiber – Skycoin’s Fiber network is the underlying <b>technology</b> for a customizable and infinitely scalable network. Creating a low cost fee for transactions, higher quality in speed and...","Mon, 27 Aug 2018 06:30:40 GMT",
Stevie Awards Honors Cisco Collaboration Team,https://blogs.cisco.com/collaboration/stevie-awards-cisco-collaboration,...future leaders.The campaign highlights our commitment to creating <b>technology</b> that fits seamlessly and transparently into the human experience of communication. We believe creating intuitive ways to...,"Mon, 27 Aug 2018 06:04:44 GMT",
