title,link,description,pubDate,guid
Alibaba Combines Blockchain with Cloud Computing,https://btcmanager.com/alibaba-combines-blockchain-with-cloud-computing/,"...incorporation of open ledger <b>technology</b> further by launching a blockchain service through its cloud... Combined with cloud computing, blockchain <b>technology</b> has the potential to push productivity and...","Mon, 27 Aug 2018 06:00:03 GMT",
"comfort, traction, as well as speed.",http://czasnazysk.pl/forum/viewtopic.php?f=7&t=22884,...freedom is evident. The PureMotion <b>technology</b> while in the outsole aids the move from jumping to ... generally will depend on PureMotion <b>technology</b>. The shoe&#39;s grip www.vinatrend.com/adidas-campus is...,"Mon, 27 Aug 2018 05:27:00 GMT",
influence of indian tv channels essay sample - Panzehir TV Sosyal,https://sosyal.panzehir.tv/showthread.php?tid=23388,...education education essay replaced by network switches information <b>technology</b> essay CLICK HERE questions on cross cultural business environments chiropractic work the safe choice essay reference...,"Mon, 27 Aug 2018 05:18:00 GMT",
Amazon opens its second Amazon Go convenience store,https://techcrunch.com/2018/08/27/amazon-opens-its-second-amazon-go-convenience-store/,"...the same as the first, from a <b>technology</b> perspective.The Go store’s system includes a number of ... competitors who want to bring similar <b>technology</b> to Amazon’s rivals and other retailers. But some...","Mon, 27 Aug 2018 05:01:36 GMT",
Kairos’ Brian Brackeen to show off facial recognition tech at Disrupt...,https://techcrunch.com/2018/08/27/kairos-brian-brackeen-to-show-off-facial-recognition-tech-at-disrupt-sf/,"That’s why Brackeen has decided that Kairos facial recognition <b>technology</b> won’t be used by any government entities or law enforcement.However, Kairos has been working to help banks and other...","Mon, 27 Aug 2018 04:36:02 GMT",
"'Game of Thrones,' 'Big Bang Theory' and 14 More TV Shows Ending in...",https://www.hollywoodreporter.com/live-feed/game-thrones-big-bang-theory-14-more-tv-shows-ending-2019-1137377,"...characters as they fumble through the modern maze of love, sex, <b>technology</b> and culture. Swanberg is considered one of a handful of writer-directors most associated with mumblecore, which is a style...","Mon, 27 Aug 2018 04:15:00 GMT",
http://twitter.com/Nathealings/status/1033924275684749312,http://twitter.com/Nathealings/status/1033924275684749312,,"Mon, 27 Aug 2018 03:48:51 GMT",
Trump rejected plans for a White House statement praising McCain,http://www.reddit.com/r/politics/comments/9ajyz6/trump_rejected_plans_for_a_white_house_statement/e4wd6i9,"Part of the fear of going against the United States in a war is going up against our military apparatus. Our <b>technology</b>. Submarines, aircraft carriers, fighter and bomber jets, etc... And the...","Mon, 27 Aug 2018 03:39:06 GMT",
Same boat with and without gyroscopic stabilizer,http://www.reddit.com/r/gifs/comments/9ajkoz/same_boat_with_and_without_gyroscopic_stabilizer/e4wcstk,"Short answer is this: gyros are just one of several ways to stabilize a boat, and they are a newer <b>technology</b>. Currently, the most widely-used method of active stabilization is hydraulic fins...","Mon, 27 Aug 2018 03:31:37 GMT",
http://twitter.com/JohnRDallasJr/status/1033919672628994048,http://twitter.com/JohnRDallasJr/status/1033919672628994048,,"Mon, 27 Aug 2018 03:30:33 GMT",
...actively pursuing this technology or were there other factors...,http://www.reddit.com/r/history/comments/9ajm96/how_is_it_that_wwii_germany_didnt_develop_nuclear/e4wcqbg,There’s a really good book called “sabotage” by Neal bascomb is basic but it explains the heavy water plant raids in interesting detail.,"Mon, 27 Aug 2018 03:30:16 GMT",
"Apple Car Will Beat Others With Stunning Augmented Reality, Report...",http://www.reddit.com/r/Futurology/comments/97jrkz/apple_car_will_beat_others_with_stunning/e4wcfo5,"...products being introduced YoY, as was possible in the early days of <b>technology</b>. They’ve had numerous fantastic iterative products since 2007 easily, which is was the entire industry is working on...","Mon, 27 Aug 2018 03:24:30 GMT",
...promising you free technology if you “test” stuff and cover the...,http://www.reddit.com/r/australia/comments/9alhj6/psa_if_you_receive_a_text_message_like_this_its_a/e4wcc02,Got the same message a while ago. There is many different variations getting around. Woolworths in another popular one. It&#39;s so fucked how many unassuming older people will get these messages and get...,"Mon, 27 Aug 2018 03:22:31 GMT",
Uncommon 0.3mm lead hardness beyond 2B,http://www.reddit.com/r/mechanicalpencils/comments/9ago1c/uncommon_03mm_lead_hardness_beyond_2b/e4wc94c,"3mm was not available if I recall correctly. Only in recent years, with more refined lead <b>technology</b>, this lead hardness became available. But this not explain that there is no 3B or 4B for 0.7mm or...","Mon, 27 Aug 2018 03:20:59 GMT",
'Rain dancing 2.0': should humans be using tech to control the...,http://www.reddit.com/r/Futurology/comments/9aeszw/rain_dancing_20_should_humans_be_using_tech_to/e4wc7g4,"No. Because you can&#39;t control what others do with the <b>technology</b>. *Everything is connected, dummies.* See: China &amp;amp; Tibet, referenced elsewhere here.","Mon, 27 Aug 2018 03:20:06 GMT",
ELI5: How does the internet work so insanely fast?,http://www.reddit.com/r/explainlikeimfive/comments/9aeptg/eli5_how_does_the_internet_work_so_insanely_fast/e4wc465,"I&#39;ve never ceased to be amazed by the speed and efficiency of data transfer, and how the <b>technology</b> is improving so...","Mon, 27 Aug 2018 03:18:21 GMT",
LEAKED- Government technology,http://www.reddit.com/r/raimimemes/comments/9aia7c/leaked_government_technology/e4wbwcj,I had this,"Mon, 27 Aug 2018 03:14:10 GMT",
Something to appreciate about Bitcoin Cash,http://www.reddit.com/r/btc/comments/9akmku/something_to_appreciate_about_bitcoin_cash/e4wbstn,"The future is still optimistic about bit cash, I hope to improve it with the advancement of <b>technology</b>.","Mon, 27 Aug 2018 03:12:19 GMT",
Sticky translocator,http://www.reddit.com/r/SombraMains/comments/99q0p7/sticky_translocator/e4wbolm,"She stole her warping <b>technology</b>, has a pulse ultimate, and flanks!","Mon, 27 Aug 2018 03:10:08 GMT",
Turnbull's tech legacy: the MTM (Malcolm-technology mix) NBN,http://www.reddit.com/r/australia/comments/9alb0k/turnbulls_tech_legacy_the_mtm_malcolmtechnology/e4wbnyz,Should be called the Malcolm Turnbull Mess &amp;amp;#x200B;,"Mon, 27 Aug 2018 03:09:49 GMT",
"Lisk Daily Discussion - August 27, 2018",http://www.reddit.com/r/Lisk/comments/9alini/lisk_daily_discussion_august_27_2018/e4wbk3c,"...an introduction to blockchain <b>technology</b>, an introduction to the Lisk Blockchain Application ... focussed and zeroed in on the <b>technology</b> right now, and although that is not sexy at present to...","Mon, 27 Aug 2018 03:07:46 GMT",
Cyberpunk 2077 Is Now Playable Start To Finish,http://www.reddit.com/r/pcgaming/comments/99qcth/cyberpunk_2077_is_now_playable_start_to_finish/e4wbd4v,"I&#39;m only talking about a brand new <b>technology</b> announced by another company, not the game itself. Games are in development for many years before they are ever announced to the public.","Mon, 27 Aug 2018 03:04:04 GMT",
http://twitter.com/mjohnson/status/1033911382456946688,http://twitter.com/mjohnson/status/1033911382456946688,,"Mon, 27 Aug 2018 02:57:37 GMT",
"In Encounter at Farpoint, Wesley falls into a creek in the holodeck...",http://www.reddit.com/r/DaystromInstitute/comments/9akh0q/in_encounter_at_farpoint_wesley_falls_into_a/e4wasqx,...something about the holodeck&#39;s underlying <b>technology</b> changed that limited the ability of objects to exit it. Exactly *how* the <b>technology</b> changed in such a way that allowed improved hologram AI but...,"Mon, 27 Aug 2018 02:53:31 GMT",
China is financially behind the South African Land Appropriation of...,http://www.reddit.com/r/geopolitics/comments/9al2fa/china_is_financially_behind_the_south_african/e4waoxu,...agreements that aimed at facilitating the exchange of experts and <b>technology</b> between the two countries. Exchange experts means driving the white farmers off their land? Where is your evidence to the...,"Mon, 27 Aug 2018 02:51:31 GMT",
"...players created a new technology and now they want to sell it, I'm...",http://www.reddit.com/r/rpg/comments/9ahh0a/my_players_created_a_new_technology_and_now_they/e4waopa,"If you are playing stars without number. At this point if that&#39;s what they want, have them make a faction for corp their corp.","Mon, 27 Aug 2018 02:51:24 GMT",
WestHamOnline.net - WHO The Online West Ham Community,http://www.westhamonline.net/forum_flat.php?9086559%7C%7C1%7C%7C#post-229bc260832f290116c0112447ac3c10,"True, Alf. What have men ever done for us? Apart from antibiotics, mass transportation, almost all <b>technology</b>, most of the best literature...","Mon, 27 Aug 2018 02:44:00 GMT",
http://twitter.com/bamitav/status/1033891962988900354,http://twitter.com/bamitav/status/1033891962988900354,,"Mon, 27 Aug 2018 01:40:27 GMT",
No DRS Threatens to Undermine CPL18,https://mostlycricket.wordpress.com/2018/08/27/no-drs-threatens-to-undermine-cpl18/,"...whisking available <b>technology</b> aside, on this, one of the biggest T20... Were these not the reasons for this <b>technology</b>-development, to...","Mon, 27 Aug 2018 01:33:35 GMT",
New Topic,http://myy.at/index.php?topic=181496.639225#msg_2082607_extra_info,"After the condo he listed on Airbnb in New York was used for an orgy, Ari Teman came up with the idea for a <b>technology</b> that can assist landlords catch illegal sublets. The primary sister company...","Sun, 26 Aug 2018 23:06:16 GMT",
http://twitter.com/ahmedjr_16/status/1033847867620843521,http://twitter.com/ahmedjr_16/status/1033847867620843521,,"Sun, 26 Aug 2018 22:45:14 GMT",
Ubex Launches Asia Roadshow in China,https://medium.com/ubex/ubex-launches-asia-roadshow-in-china-3a4b10fb2cc0,...campaign at the BLC Blockchain <b>Technology</b> Summit 2018 in Shanghai by presenting the platform on one ... platform.The BLC Blockchain <b>Technology</b> Summit 2018 in Shanghai on the 24–25 of August was the...,"Sun, 26 Aug 2018 20:54:04 GMT",
Omarosa Manigault Newman,https://en.wikipedia.org/wiki/Omarosa_Manigault_Newman,"Cheryl Shavers , who then served as the Commerce Department&#39;s Undersecretary for <b>Technology</b> Administration, said that Omarosa was &quot;unqualified and disruptive,&quot; adding, &quot;I had her removed.&quot;Reality...","Sun, 26 Aug 2018 19:32:00 GMT",
http://twitter.com/WadeOnTweets/status/1033746043719036934,http://twitter.com/WadeOnTweets/status/1033746043719036934,,"Sun, 26 Aug 2018 16:00:37 GMT",
Meet the Speakers—Political Economy of Capitalism,https://medium.com/@laurene.tran/meet-the-speakers-political-economy-of-capitalism-9877c9ace98b,"...development and growth. We look at how economic actors, policies, <b>technology</b> and market conditions interact and evolve over time. We provide a platform to create professional and academic networks...","Sun, 26 Aug 2018 15:29:31 GMT",
http://twitter.com/DashForceNews/status/1033729376913948672,http://twitter.com/DashForceNews/status/1033729376913948672,,"Sun, 26 Aug 2018 14:54:23 GMT",
Vodacom Launches Commercial 5G service in Lesotho,http://4g5gworld.com/news/vodacom-launches-commercial-5g-service-lesotho,"The immediate benefit of 5G <b>technology</b> for Vodacom subscribers in Lesotho includes the quicker ... of the same standards-based 5G <b>technology</b> in South Africa, with speeds in excess of 700 Mbps and...","Sun, 26 Aug 2018 13:51:08 GMT",
Why do you invest in Crypto?,https://bitcointalk.org/index.php?topic=3327279.3020#subject_44696884,"The main thing is to be able to maneuver them, draw conclusions and learn the main lesson. And so I believe in this <b>technology</b>. I believe that it will change the world for the...","Sun, 26 Aug 2018 07:20:37 GMT",
http://twitter.com/seth_aklade/status/1033424770900144128,http://twitter.com/seth_aklade/status/1033424770900144128,,"Sat, 25 Aug 2018 18:44:00 GMT",
http://twitter.com/GearBooks/status/1033414967914115074,http://twitter.com/GearBooks/status/1033414967914115074,,"Sat, 25 Aug 2018 18:05:02 GMT",
Cancer Prevention Research Institute of Texas,http://www.cprit.state.tx.us/news/cprit-surpasses-2-billion-milestone-with-64-new-grants/,The Core Facilities awards make cutting edge <b>technology</b> available to multiple research ... effects of chemotherapy based on <b>technology</b> designed at The University of Texas MD Anderson Cancer...,"Fri, 24 Aug 2018 20:00:30 GMT",
http://twitter.com/BeccaFatokun/status/1033018518210535425,http://twitter.com/BeccaFatokun/status/1033018518210535425,,"Fri, 24 Aug 2018 15:49:41 GMT",
http://twitter.com/collabothon2018/status/1033006554075881472,http://twitter.com/collabothon2018/status/1033006554075881472,,"Fri, 24 Aug 2018 15:02:09 GMT",