title,link,description,pubDate,guid
"Santa Cruz Blur long-term review: A sharper focus, but more limited...",https://cyclingtips.com/2018/08/2019-santa-cruz-blur-review/,"...of climbing, but recent advancements in geometry and suspension <b>technology</b> make it far more versatile and fun overall than any of its predecessors could ever hope to be. Personally, I still wish that...","Mon, 27 Aug 2018 14:44:06 GMT",
Flying drones to be legal in India from December 1,https://www.indiatoday.in/india/story/flying-drones-legal-december-1-1324734-2018-08-27,"...to prepare regulations, including the quick evolution of drone <b>technology</b> and the need for extra precautions in India&#39;s security environment.FULL TEXT OF MINISTRY&#39;S...","Mon, 27 Aug 2018 14:42:52 GMT",
http://twitter.com/KryptTipp/status/1034086953057247233,http://twitter.com/KryptTipp/status/1034086953057247233,,"Mon, 27 Aug 2018 14:35:16 GMT",
How to Tame Health Care Spending? Here’s a One-Percent Solution,https://www.nytimes.com/2018/08/27/upshot/rising-health-care-costs-economists-propose-small-solutions.html,"The new paper , from researchers at the Massachusetts Institute of <b>Technology</b> and the University of Chicago, took a close look at what happened to patients as new long-term care hospitals opened...","Mon, 27 Aug 2018 14:33:57 GMT",
http://twitter.com/mraspinall/status/1034086584939888640,http://twitter.com/mraspinall/status/1034086584939888640,,"Mon, 27 Aug 2018 14:33:48 GMT",
http://twitter.com/Temenos/status/1034085374870597634,http://twitter.com/Temenos/status/1034085374870597634,,"Mon, 27 Aug 2018 14:29:00 GMT",
Iran Finalizes Draft on National Cryptocurrency as US Sanctions Sting,https://www.ccn.com/breaking-iran-reveals-national-cryptocurrency-features-as-u-s-sanctions-sting/,...developed on the Linux Foundation-led open-source Hyperledger Fabric <b>technology</b>. In contrast to decentralized cryptocurrencies such as Bitcoin that are issued in compliance with a mathematical...,"Mon, 27 Aug 2018 14:28:25 GMT",
Event Venues in London | The Ritz London Hotel,https://www.theritzlondon.com/plan-an-event/event-rooms/,...receptions and seats up to 60 guests for meetings.Individual <b>technology</b> arrangements can be tailor made to suit your requirements.The Marie Antoinette Suite is located off the hotel’s Long Galley...,"Mon, 27 Aug 2018 14:28:21 GMT",
http://twitter.com/StrangeHeart22/status/1034083799556976640,http://twitter.com/StrangeHeart22/status/1034083799556976640,,"Mon, 27 Aug 2018 14:22:44 GMT",
http://twitter.com/rgaventures/status/1034083705961308162,http://twitter.com/rgaventures/status/1034083705961308162,,"Mon, 27 Aug 2018 14:22:22 GMT",
http://twitter.com/Smartum_Pro/status/1034083502264864768,http://twitter.com/Smartum_Pro/status/1034083502264864768,,"Mon, 27 Aug 2018 14:21:33 GMT",
"In 2017, four US states generated more than 30% of their electricity...",https://arstechnica.com/information-technology/2018/08/in-2017-four-us-states-generated-more-than-30-of-their-electricity-from-wind/,"...DoE) released the 2017 Wind <b>Technology</b> Report (PDF), showing that wind energy had an extremely ... with each turn. And as turbine <b>technology</b> improves and gets cheaper to build, rotor diameters have...","Mon, 27 Aug 2018 14:20:59 GMT",
Stocks open higher as hope for trade deal with Mexico grows,https://www.washingtontimes.com/news/2018/aug/27/stocks-open-higher-as-hope-for-trade-deal-with-mex/,"...Monday morning, and gains for <b>technology</b> companies, banks and industrial firms have U.S. stocks on ... the market. That also included <b>technology</b> companies. Facebook picked up 1.5 percent to $177.25 and...","Mon, 27 Aug 2018 14:20:42 GMT",
Cat Lamp – Seletti,https://www.seletti.it/product-category/job-seletti/cat-lamp/,"...cm 46 x 12 h 20,7LED light <b>technology</b>0,06W X2 – 3300K Warm lightUSB rechargable ( charge time ... cm 46 x 12 h 20,7LED light <b>technology</b>0,06W X2 – 3300K Warm lightUSB rechargable ( charge time...","Mon, 27 Aug 2018 14:20:28 GMT",
http://twitter.com/TechSpective/status/1034082400693878785,http://twitter.com/TechSpective/status/1034082400693878785,,"Mon, 27 Aug 2018 14:17:11 GMT",
Microsoft's Xbox VR Headset Put On Hold - Report,https://uploadvr.com/microsofts-xbox-vr-headset-put-on-hold-report/,Plans for a release were apparently put on hold in order to wait for better <b>technology</b> that could deliver a much more immersive experience.Microsoft’s messaging around Xbox VR definitely seems to...,"Mon, 27 Aug 2018 14:16:20 GMT",
Gazprom And Russian Airline S7 Put Aircraft Fuelling on Blockchain in...,https://cointelegraph.com/news/gazprom-and-russian-airline-s7-put-aircraft-fuelling-on-blockchain-in-domestic-first,"...past two years, will now use the <b>technology</b> to increase efficiency of fuel delivery and payment, as ... Group CIO Pavel Voronin added:“<b>Technology</b> means transparency in reciprocal settlements is...","Mon, 27 Aug 2018 14:15:00 GMT",
http://twitter.com/WhatTheFFacts/status/1034081851369897989,http://twitter.com/WhatTheFFacts/status/1034081851369897989,,"Mon, 27 Aug 2018 14:15:00 GMT",
Kemenristekdikti Segera Tutup 1.000 Perguruan Tinggi,https://www.cendananews.com/2018/08/kemenristekdikti-segera-tutup-1-000-perguruan-tinggi.html,"...ujarnya, saat menghadiri International Conference On Smart Green <b>Technology</b> (ICSGT) di Malang, Senin (27/8/2018). Menurutnya, masyarakat Indonesia saat ini yang memiliki usia-usia kuliah, hanya 31...","Mon, 27 Aug 2018 14:13:40 GMT",
CalPERS CEO Marcie Frost's Misrepresentations Regarding Her Education...,https://www.nakedcapitalism.com/2018/08/calpers-ceo-marcie-frosts-misrepresentations-regarding-her-education-and-work-history-during-and-after-her-hiring.html,She worked for a year in information <b>technology</b> with the Washington State Employees Credit Union ... Implemented the first human resource <b>technology</b> systems for the State of Washington.Anyone over...,"Mon, 27 Aug 2018 14:11:42 GMT",
IDF pilot program: Nurses to join doctors behind enemy lines,https://www.jpost.com/Israel-News/IDF-pilot-program-Nurses-to-join-doctors-behind-enemy-lines-565902,"...senior IDF officer in the IDF <b>Technology</b> and Logistics Division, explaining that the military hopes ... professional.The IDF military’s <b>technology</b> and logistics branch is also improving medical...","Mon, 27 Aug 2018 14:10:43 GMT",
[Trailer] NES-Style 8-bit Game ‘Haunted: Halloween ’86’ Now Available...,https://bloody-disgusting.com/video-games/3517901/trailer-nes-style-8-bit-game-haunted-halloween-86-now-available-xbox-one/,...“ 86 has been upgraded in every way! You can utilize Tag Team <b>Technology</b> to swap between the two playable characters on the fly throughout the game to take advantage of their separate skills and...,"Mon, 27 Aug 2018 14:08:40 GMT",
Flying drones to be legal in India from December 1,https://www.businesstoday.in/sectors/aviation/flying-drones-to-be-legal-in-india-from-december-1/story/281690.html,"...Aviation.The Ministry of Civil Aviation said that drones are a <b>technology</b> platform that has wide-ranging applications from photography to agriculture, from infrastructure asset maintenance to...","Mon, 27 Aug 2018 14:08:12 GMT",
True Detective Looks to Rediscover Its Mojo in Its First Trailer for...,https://www.adweek.com/tv-video/true-detective-looks-to-rediscover-its-mojo-in-its-first-trailer-for-season-3/,"it/2MwBFD0Jason Lynch@jasonlynchJason Lynch is Adweek&#39;s TV/Media Editor, overseeing trends, <b>technology</b>, personalities and programming across broadcast, cable and streaming video. Formerly TV...","Mon, 27 Aug 2018 14:06:34 GMT",
Electric shock collars for pets to be banned,https://www.bbc.com/news/uk-england-45320038,"...by banning a proven <b>technology</b>,&quot; he said.&quot;The hundreds of thousands...","Mon, 27 Aug 2018 14:05:19 GMT",
http://twitter.com/TechCrunch/status/1034079083607482368,http://twitter.com/TechCrunch/status/1034079083607482368,,"Mon, 27 Aug 2018 14:04:00 GMT",
Workplace consulting firm Diverse City eyes L.A. expansion as founder...,https://www.geekwire.com/2018/workplace-consulting-firm-diverse-city-eyes-l-expansion-founder-shares-seattle-frustrations/,"”, taking place on Oct. 1-3, 2018 in Seattle, one of the country’s premier <b>technology</b> conferences, bringing together more than 900 innovators and tech leaders together for an immersive two-day...","Mon, 27 Aug 2018 14:02:02 GMT",
"Selling Everything, Moving to Asia, and Setting Up a Company",https://hackaday.com/2018/08/27/life-on-contract-moving-to-asia-and-setting-up-a-company/,"I used to consider networking events useless, and just worked hard for my existing clients and developed <b>technology</b> I thought I would need later. What I missed out on were more interesting projects...","Mon, 27 Aug 2018 14:01:02 GMT",
Recent editorials published in Iowa newspapers,https://www.washingtontimes.com/news/2018/aug/27/recent-editorials-published-in-iowa-newspapers/,"...preparation in STEM (science, <b>technology</b>, engineering and math) has been identified as a critical ... outstanding career opportunities in a <b>technology</b>-driven economy. These are Iowa jobs that pay well...","Mon, 27 Aug 2018 14:00:51 GMT",
http://twitter.com/JohnFMauldin/status/1034078086155915265,http://twitter.com/JohnFMauldin/status/1034078086155915265,,"Mon, 27 Aug 2018 14:00:02 GMT",
Top 7 things you need to know about Fortnite for Android,https://www.androidcentral.com/top-things-you-need-know-about-fortnite-android,"...mods to your phone, and Samsung and others developing docking <b>technology</b> for connecting a keyboard and mouse for a desktop experience, there&#39;s a ton of potential even beyond Bluetooth accessories...","Mon, 27 Aug 2018 14:00:01 GMT",
Nomad Slim Wallet with Tile Tracking review: Keep track of your wallet...,https://www.imore.com/nomad-slim-wallet-tile-tracking-review,"...<b>technology</b> accessories, a lot of companies focus on making gadgets look sleek like said <b>technology</b> ... <b>technology</b> accessories, a lot of companies focus on making gadgets look sleek like said <b>technology</b>...","Mon, 27 Aug 2018 14:00:01 GMT",
Game Day: Donut County – MacStories,https://www.macstories.net/reviews/game-day-donut-county/,"Esposito, who lives in Los Angeles, has said the story is an allegory for L.A.’s gentrification and how <b>technology</b> played a part in it. That may seem like a heavy message, but it works in the game...","Mon, 27 Aug 2018 14:00:00 GMT",
"It has the product, price and the performance, but Poco needs a tale",http://techpp.com/2018/08/27/poco-branding-positioning-opinion/,The reason? OnePlus had a rather different ace up its sleeve. One that had nothing to do with <b>technology</b> and very little to do with pricing either. It had a narrative. Or in simple English: it had...,"Mon, 27 Aug 2018 13:59:47 GMT",
Russia's Largest Airline Tests Blockchain in Bid to Track Fuel...,https://www.coindesk.com/russias-largest-airline-tests-blockchain-in-bid-to-track-fuel-payments/,"...statement. It added that as the <b>technology</b> has eliminated &quot;a number of manual operations,&quot; the ... S7&#39;s deputy head for information <b>technology</b>, said in a statement.The trial represents S7&#39;s latest...","Mon, 27 Aug 2018 13:59:39 GMT",
Electric shock collars for pets to be banned,https://www.bbc.co.uk/news/uk-england-45320038,"...by banning a proven <b>technology</b>,&quot; he said.&quot;The hundreds of thousands...","Mon, 27 Aug 2018 13:59:00 GMT",
http://twitter.com/indianDevJourne/status/1034077819158945794,http://twitter.com/indianDevJourne/status/1034077819158945794,,"Mon, 27 Aug 2018 13:58:58 GMT",
"State, Amtrak say safety tech to be installed by deadline",https://www.washingtontimes.com/news/2018/aug/27/state-amtrak-say-safety-tech-to-be-installed-by-de/,"...they’re confident a new safety <b>technology</b> will be installed on the rail corridor between Seattle ... of the Dec. 31 deadline.The <b>technology</b>, known as positive train control, or PTC, was not...","Mon, 27 Aug 2018 13:58:30 GMT",
Major airlines accused of extending flight times to avoid payouts,https://www.secretflying.com/posts/major-airlines-accused-of-extending-flight-times-to-avoid-payouts/,"...minutes to scheduled flight times, despite improvements in aircraft <b>technology</b>.Researchers examined scheduled flight times for 125 routes operated by major airlines in 2009 and compared with the...","Mon, 27 Aug 2018 13:56:19 GMT",
http://twitter.com/ladies_african/status/1034076375156776961,http://twitter.com/ladies_african/status/1034076375156776961,,"Mon, 27 Aug 2018 13:53:14 GMT",
http://twitter.com/DavidRo19158533/status/1034076292365266944,http://twitter.com/DavidRo19158533/status/1034076292365266944,,"Mon, 27 Aug 2018 13:52:54 GMT",
Markets Right Now: Stocks open higher on Wall Street,https://www.washingtontimes.com/news/2018/aug/27/markets-right-now-stocks-open-higher-on-wall-stree/,"Stocks are opening broadly higher on Wall Street, extending the market’s gains from last week.<b>Technology</b> companies and banks were among the biggest winners in early trading Monday. Facebook rose...","Mon, 27 Aug 2018 13:52:02 GMT",
"Iran has control of Persian Gulf, Strait of Hormuz, Iranian Navy chief...",https://www.upi.com/Top_News/World-News/2018/08/27/Iran-has-control-of-Persian-Gulf-Strait-of-Hormuz-Iranian-Navy-chief-says/6701535376995/,"&quot;The capabilities of this force [the Iranian navy], in terms of <b>technology</b>, tactics and strategies, are up-to-date and geared to the advancement of technologies at the highest level,&quot; Jafari said...","Mon, 27 Aug 2018 13:51:34 GMT",
http://twitter.com/Butsay_/status/1034075824671084545,http://twitter.com/Butsay_/status/1034075824671084545,,"Mon, 27 Aug 2018 13:51:03 GMT",
18.04 - Freezes intempestifs,http://forum.ubuntu-fr.org/viewtopic.php?id=2029899,"...Default string) vendor: Gigabyte <b>Technology</b> Co., Ltd. version: Default string serial: Default ... B250M-D2V-CF vendor: Gigabyte <b>Technology</b> Co., Ltd. physical id: 0 version: x.x serial: Default...","Mon, 27 Aug 2018 13:51:00 GMT",
Palmer Luckey says Magic Leap is a ‘tragic heap’,https://www.cnbc.com/2018/08/27/palmer-luckey-says-magic-leap-is-a-tragic-heap.html,"&quot;Lucky also said that Magic Leap uses <b>technology</b> that Microsoft has been including in the ... and LED illumination, the same <b>technology</b> everyone else has been using for years, including...","Mon, 27 Aug 2018 13:47:47 GMT",
"Students, here are nine tips for balancing journalism with school (and...",https://www.poynter.org/news/students-here-are-nine-tips-balancing-journalism-school-and-rest-your-life,"...friends/coworkers had my back,” she said.Take time away from <b>technology</b>, too. Isabella Cueto, a reporter for The State in Columbia, South Carolina, suggests turning off iMessage on your laptop to...","Mon, 27 Aug 2018 13:46:42 GMT",
The 3 schools where women graduates are making more than men,https://www.cnbc.com/2018/08/27/study-schools-where-female-graduates-are-making-more-than-men.html,"...Clark University in Worcester, Massachusetts; Stevens Institute of <b>Technology</b> in Hoboken, New Jersey and Yale University in New Haven, Connecticut. At Clark, women alumni pull in a mean salary of...","Mon, 27 Aug 2018 13:45:00 GMT",
http://twitter.com/EUCYPRUS/status/1034073960349147152,http://twitter.com/EUCYPRUS/status/1034073960349147152,,"Mon, 27 Aug 2018 13:43:38 GMT",
"Forget projectors: Samsung, PVR join hands for LED screens in...",https://timesofindia.indiatimes.com/business/india-business/forget-projectors-samsung-pvr-join-hands-for-led-screens-in-multiplexes/articleshow/65565013.cms,"...costs.Samsung said that the LED <b>technology</b> for large screens is being rolled out in countries ... officials said, adding that the new <b>technology</b> offers picture quality in line with the clarity...","Mon, 27 Aug 2018 13:43:03 GMT",
Reserve Bank of India Quietly Opens Cryptocurrency Research Unit,https://www.financemagnates.com/cryptocurrency/news/reserve-bank-of-india-quietly-opens-cryptocurrency-research-unit/,Sources say that the unit could possibly draft rules for the supervision of new <b>technology</b> in the future.Eleborate Ponzi schemesThis could signal a turnaround in the Indian government’s view of...,"Mon, 27 Aug 2018 13:42:50 GMT",
10 reasons why you should introduce workplace apps,https://www.turbinehq.com/blog/introduce-workplace-apps,"...businesses begin to adopt cloud <b>technology</b>, many are also introducing Software as a Service (SaaS) ... forget, you can&#39;t just rely on the <b>technology</b>, you need to be a good manager , too) your team will...","Mon, 27 Aug 2018 13:39:24 GMT",
كورس تدريبى التحكم في التآكل في أنابيب الغاز الطبيعي | دورات البترول...,http://www.shababharb.com/vb/showthread.php?t=81658,...Pipe <b>technology</b> in the petroleum industry التكنولوجيا في الصناعات البترولية <b>Technology</b> in the ... المياه - متقدم Water Treatment <b>Technology</b> - Advanced اسيات تكرير النفط oil refining fundamentals...,"Mon, 27 Aug 2018 13:39:00 GMT",
Industry body representing Google and others actively lobbying for...,https://9to5google.com/2018/08/27/federal-privacy-law/,"...president of a leading tech industry lobbying group, the Information <b>Technology</b> Industry Council, which is working on proposals for the federal law. “The best way is to work toward developing our own...","Mon, 27 Aug 2018 13:38:57 GMT",
"New Russia Sanctions, Putin’s Economy, and the Shadow Over Planned...",https://www.justsecurity.org/60454/russia-sanctions-putins-economy-shadow-planned-u-s-russia-business-group/,"...compliance bill and another to ban imports of essential medications and <b>technology</b>, and employment of U.S. citizens in Russia. Dmitry Kostin, the president of state-owned VTB Bank who was sanctioned...","Mon, 27 Aug 2018 13:38:14 GMT",
New US Sanctions Won't Keep Russia From Defending Its National...,https://sputniknews.com/world/201808271067505829-us-russia-sanctions/,...and prohibited exports of national security-sensitive goods and <b>technology</b>.,"Mon, 27 Aug 2018 13:36:38 GMT",
I Trained Like a Strongman for Four Months. Here’s What Happened,https://www.muscleandfitness.com/strongman,"Out of the gym, Triana implemented a series of guidelines I was to follow:No <b>technology</b> 30 minutes before bed (this one was tough. I love me a YouTube rabbit hole.) Get at least eight hours of...","Mon, 27 Aug 2018 13:36:13 GMT",
http://twitter.com/universityicons/status/1034071547932225536,http://twitter.com/universityicons/status/1034071547932225536,,"Mon, 27 Aug 2018 13:34:03 GMT",
distrust of online shopping floors,http://www.chryslerclub.su/forum/viewtopic.php?f=30&t=101917,"...departments of science and <b>technology</b> such as Dongguan City and Changping Town. After the completion of the Forest Science and <b>Technology</b> Fulin <b>Technology</b> R&amp;D Center,real wood floors vintage loft it...","Mon, 27 Aug 2018 13:34:00 GMT",
Internet groups urge US court to reinstate 'net neutrality' rules,https://www.rawstory.com/2018/08/internet-groups-urge-us-court-reinstate-net-neutrality-rules/,"...including Mozilla Corp, Vimeo Inc, Etsy Inc, and numerous media and <b>technology</b> advocacy groups.Others have told the court they plan to back the effort to reverse the net neutrality repeal...","Mon, 27 Aug 2018 13:34:00 GMT",
Do you think technology will ever reach a point...,https://www.thestudentroom.co.uk/showthread.php?t=5548462,...where attachments on TSR work properly?,"Mon, 27 Aug 2018 13:33:28 GMT",
Microsoft Smart Batteries Could Transform Surface Battery Performance,https://winbuzzer.com/2018/08/27/microsoft-smart-batteries-could-transform-surface-battery-performance-xcxwbn/,Batteries are an area of consumer <b>technology</b> where companies should be ultra-competitive. While ... significant breakthrough in battery <b>technology</b> is surely onto a winner. It is worth remembering...,"Mon, 27 Aug 2018 13:31:15 GMT",
Industry body representing Apple and others actively lobbying for...,https://9to5mac.com/2018/08/27/federal-privacy-law/,"...group, the Information <b>Technology</b> Industry Council, which is working...","Mon, 27 Aug 2018 13:30:53 GMT",
http://twitter.com/PetroteqEnergy/status/1034070693569339392,http://twitter.com/PetroteqEnergy/status/1034070693569339392,,"Mon, 27 Aug 2018 13:30:40 GMT",
http://twitter.com/Infosys/status/1034070648950276098,http://twitter.com/Infosys/status/1034070648950276098,,"Mon, 27 Aug 2018 13:30:29 GMT",
http://twitter.com/ecloudchain/status/1034070600065732609,http://twitter.com/ecloudchain/status/1034070600065732609,,"Mon, 27 Aug 2018 13:30:17 GMT",
http://twitter.com/thedailybeast/status/1034070558953164800,http://twitter.com/thedailybeast/status/1034070558953164800,,"Mon, 27 Aug 2018 13:30:08 GMT",
http://twitter.com/FirstNet/status/1034070551650885632,http://twitter.com/FirstNet/status/1034070551650885632,,"Mon, 27 Aug 2018 13:30:06 GMT",
Where does DevOps start? Not where you think,https://www.techrepublic.com/article/where-does-devops-start-not-where-you-think/,"...stage, said Andi Mann, chief <b>technology</b> advocate at Splunk, a sponsor of this year&#39;s ... Portland, Oregon, covering business <b>technology</b> for ZDNet. She previously covered politics for...","Mon, 27 Aug 2018 13:30:00 GMT",
http://twitter.com/iLeadersSummit/status/1034068830925008897,http://twitter.com/iLeadersSummit/status/1034068830925008897,,"Mon, 27 Aug 2018 13:23:16 GMT",
http://twitter.com/JohnNosta/status/1034066672615911426,http://twitter.com/JohnNosta/status/1034066672615911426,,"Mon, 27 Aug 2018 13:14:41 GMT",
Dr Mahathir to Revive Cyberjaya and Multimedia Super Corridor,https://sgtalk.org/mybb/Thread-Dr-Mahathir-to-Revive-Cyberjaya-and-Multimedia-Super-Corridor,"...Government the government would revive Cyberjaya to be more focused on <b>technology</b>-based industries, adding that there could be a second wave of development in the Multimedia Super Corridor, driven by...","Mon, 27 Aug 2018 13:14:29 GMT",
Trump Moves to Open 1.6 Million Acres of California Public Lands to...,https://www.globalresearch.ca/trump-moves-to-open-1-6-million-acres-of-california-public-lands-to-fracking/5651979,"The later risk is increased in California, a 2015 report from the California Council on Science and <b>Technology</b> found, because fracking in the state happens in areas with shallow depths close to...","Mon, 27 Aug 2018 13:10:10 GMT",
"Myanmar generals had 'genocidal intent' against Rohingya, must face...",https://www.reuters.com/article/us-myanmar-rohingya-un/myanmar-generals-had-genocidal-intent-against-rohingya-must-face-justice-un-idUSKCN1LC0KN,"While we were too slow to act, we’re now making progress – with better <b>technology</b> to identify hate speech, improved reporting tools, and more people to review content.”Facebook had acknowledged in...","Mon, 27 Aug 2018 13:09:30 GMT",
Are brands approaching a crisis in authenticity?,https://martechtoday.com/are-brands-approaching-a-crisis-in-authenticity-223296,"...insights of where marketing, <b>technology</b>, and management converge.Google has demonstrated how its... ”Barry Levine covers marketing <b>technology</b> for Third Door Media. Previously, he covered this space...","Mon, 27 Aug 2018 13:09:15 GMT",
Waymo is getting a pathway into China,https://www.businessinsider.com/waymo-huimo-business-consulting-shanghai-2018-8,"Waymo, Alphabet&#39;s self-driving <b>technology</b> spin-off, established a subsidiary in Shanghai back in ... and development of self-driving <b>technology</b> components.&quot; But more importantly, Huimo opens the door...","Mon, 27 Aug 2018 13:08:07 GMT",
http://twitter.com/CenturyLink/status/1034063269672247296,http://twitter.com/CenturyLink/status/1034063269672247296,,"Mon, 27 Aug 2018 13:01:10 GMT",
A roundup of recent Michigan newspaper editorials,https://www.washingtontimes.com/news/2018/aug/27/a-roundup-of-recent-michigan-newspaper-editorials/,"...broadband, high speed internet to all of the state of Michigan.“As <b>technology</b> continues to rapidly change and evolve, having access to fast, reliable internet is now a necessity for everyday life,”...","Mon, 27 Aug 2018 13:00:53 GMT",
New patent suggests that Microsoft might be working smart batteries...,https://mspoweruser.com/new-patent-suggests-that-microsoft-might-be-working-smart-batteries-for-surface-devices/,"Since there is no other evidence of the <b>technology</b> apart from the patent, it’s safe to say that ... Microsoft starts implementing the <b>technology</b> into the Surface...","Mon, 27 Aug 2018 13:00:21 GMT",
Grow Your Makerspace: Technology Tailgating,https://makezine.com/2018/08/27/grow-your-makerspace-technology-tailgating/,"...the fun? Here’s how to add some <b>technology</b> to the event for some unique maker dinner fun and raise ... into friends and if you add a <b>technology</b> component, will create a lasting memory and will help...","Mon, 27 Aug 2018 13:00:03 GMT",
The Entrepreneur Behind This Popular Travel Brand Shares How to Keep...,https://www.entrepreneur.com/article/319021,"Jen RubioNina ZipkinEntrepreneur StaffStaff Writer. Covers leadership, media, <b>technology</b> and culture.August 27, 2018Editor’s Note: Inspire Me is a series in which entrepreneurs and...","Mon, 27 Aug 2018 13:00:00 GMT",
Information Technology,https://www.thestudentroom.co.uk/showthread.php?t=5548372,What is IT,"Mon, 27 Aug 2018 12:56:55 GMT",
